{
  "p0": 1,
  "p1": 1,
  "score": 50,
  "p2": 2,
  "p3": 2,
  "total": 6,
  "domain_breakdown": {
    "security": 1,
    "data": 2,
    "privacy": 2,
    "evolution": 1
  },
  "timestamp": "2026-08-01T06:31:16.294550+00:00",
  "commit": "a585f1d feat: comprehensive detailed runbook procedures for all 245 products",
  "blocked": true
}